{
  "$schema": "https://json-schema.org/draft/2020-12/schema",
  "$id": "scene.schema.json",
  "title": "scene.json",
  "description": "單一 scene 的定義與狀態（SPEC §4.2）。路徑相對於 scene 目錄；以 `@/` 開頭則相對於專案根目錄。",
  "type": "object",
  "$ref": "common.schema.json#/$defs/extensions",
  "unevaluatedProperties": false,
  "required": ["id", "title", "purpose", "narration", "visual", "durationSec", "status", "locked"],
  "properties": {
    "$schema": { "type": "string" },
    "id": { "$ref": "common.schema.json#/$defs/sceneId" },
    "title": { "type": "string", "minLength": 1, "maxLength": 120 },
    "purpose": {
      "enum": ["hook", "problem", "solution", "feature", "how-it-works", "benefit", "social-proof", "cta", "opening", "setup", "conflict", "climax", "resolution", "ending", "custom"]
    },
    "narration": { "$ref": "#/$defs/narration" },
    "visual": { "$ref": "#/$defs/visual" },
    "durationSec": {
      "description": "null：由旁白音長 + 0.5 秒決定；數值：強制秒數。幀數一律由 durationSec × fps 推得，不儲存。",
      "type": ["number", "null"],
      "exclusiveMinimum": 0,
      "maximum": 120
    },
    "status": { "$ref": "#/$defs/sceneStatus" },
    "render": {
      "description": "最近一次成功渲染的紀錄。stale 時保留舊紀錄以供比對。",
      "anyOf": [{ "$ref": "#/$defs/render" }, { "type": "null" }]
    },
    "locked": {
      "description": "true 時 Agent 不得修改此 scene，除非使用者明確要求。不納入 inputHash。",
      "type": "boolean",
      "default": false
    },
    "error": {
      "anyOf": [{ "$ref": "#/$defs/error" }, { "type": "null" }]
    },
    "feedback": {
      "description": "使用者在網頁上看這一段影片時留的意見，可指出時間點與畫面位置（SPEC §9.3）。Agent 重做這一段時逐條處理，處理完填 resolvedAt 與 reply；不刪除。不納入 inputHash。",
      "type": "array",
      "items": { "$ref": "#/$defs/feedbackNote" }
    },
    "attempts": {
      "description": "連續失敗次數，成功後歸零。Agent 自動重試上限 2 次（SPEC §8.1 規則 10）。",
      "type": "integer",
      "minimum": 0,
      "default": 0
    },
    "updatedAt": { "$ref": "common.schema.json#/$defs/timestamp" },
    "updatedBy": { "$ref": "common.schema.json#/$defs/updatedBy" }
  },
  "allOf": [
    {
      "description": "已渲染或已核准的 scene 必須有渲染紀錄。",
      "if": { "properties": { "status": { "enum": ["rendered", "approved", "stale"] } }, "required": ["status"] },
      "then": { "required": ["render"], "properties": { "render": { "$ref": "#/$defs/render" } } }
    },
    {
      "description": "失敗的 scene 必須記錄錯誤。",
      "if": { "properties": { "status": { "const": "failed" } }, "required": ["status"] },
      "then": { "required": ["error"], "properties": { "error": { "$ref": "#/$defs/error" } } }
    }
  ],
  "$defs": {
    "sceneStatus": {
      "description": "SPEC §4.5。",
      "enum": ["draft", "assets_ready", "rendering", "rendered", "approved", "stale", "failed"]
    },
    "seconds": { "type": "number", "minimum": 0 },
    "narration": {
      "type": "object",
      "additionalProperties": false,
      "required": ["scriptFile"],
      "properties": {
        "scriptFile": { "$ref": "common.schema.json#/$defs/relPath", "default": "script.md" },
        "provider": {
          "description": "省略時沿用 project.tts.provider。",
          "$ref": "common.schema.json#/$defs/ttsProvider"
        },
        "voice": { "description": "省略時沿用 project.tts.voice。", "type": "string", "minLength": 1 },
        "speed": { "type": "number", "minimum": 0.5, "maximum": 2, "default": 1 },
        "audioFile": { "$ref": "common.schema.json#/$defs/relPath", "default": "assets/narration.mp3" },
        "pronunciation": {
          "description": "Scene 專屬發音補丁對照表：{ \"原字/詞\": \"發音替換字或注音\" }。",
          "type": "object",
          "additionalProperties": { "type": "string" }
        }
      }
    },
    "visual": {
      "type": "object",
      "$ref": "common.schema.json#/$defs/extensions",
      "unevaluatedProperties": false,
      "required": ["type", "description"],
      "properties": {
        "type": {
          "description": "web-capture：Playwright 錄製網頁操作；screenshot：靜態截圖 + 動效；motion-graphic：純動畫（可用 motion 指定自寫的動畫模組）；code：程式碼展示；user-asset：使用者提供的影片或圖片。",
          "enum": ["web-capture", "screenshot", "motion-graphic", "code", "user-asset"]
        },
        "description": {
          "description": "給人與 Agent 讀的畫面描述。",
          "type": "string",
          "minLength": 1
        },
        "capture": { "$ref": "#/$defs/capture" },
        "code": { "$ref": "#/$defs/code" },
        "asset": { "$ref": "#/$defs/userAsset" },
        "motion": { "$ref": "#/$defs/motion" },
        "elements": {
          "description": "疊加在畫面上的元素。",
          "type": "array",
          "items": { "$ref": "#/$defs/element" },
          "default": []
        },
        "transitionIn": {
          "description": "進場轉場；第一個 scene 的轉場會被忽略。",
          "enum": ["none", "fade", "slide-left", "slide-right", "wipe", "zoom"],
          "default": "none"
        }
      },
      "allOf": [
        {
          "if": { "properties": { "type": { "enum": ["web-capture", "screenshot"] } } },
          "then": { "required": ["capture"] }
        },
        {
          "if": { "properties": { "type": { "const": "code" } } },
          "then": { "required": ["code"] }
        },
        {
          "if": { "properties": { "type": { "const": "user-asset" } } },
          "then": { "required": ["asset"] }
        },
        {
          "description": "motion 只用於 motion-graphic。",
          "if": { "required": ["motion"] },
          "then": { "properties": { "type": { "const": "motion-graphic" } } }
        }
      ]
    },
    "capture": {
      "type": "object",
      "additionalProperties": false,
      "required": ["url"],
      "properties": {
        "url": { "type": "string", "format": "uri", "pattern": "^https?://" },
        "viewport": {
          "description": "省略時使用 project.format 的寬高。",
          "type": "object",
          "additionalProperties": false,
          "required": ["width", "height"],
          "properties": {
            "width": { "type": "integer", "minimum": 320, "maximum": 3840 },
            "height": { "type": "integer", "minimum": 320, "maximum": 3840 }
          }
        },
        "actions": {
          "type": "array",
          "items": { "$ref": "#/$defs/captureAction" },
          "default": []
        },
        "domEditConsent": {
          "description": "使用者同意在錄製時以 script 動作修改頁面內容（例如填入示意資料）的紀錄。",
          "type": "object",
          "additionalProperties": false,
          "required": ["granted"],
          "properties": {
            "granted": { "type": "boolean" },
            "grantedAt": { "$ref": "common.schema.json#/$defs/timestamp" }
          },
          "if": { "properties": { "granted": { "const": true } } },
          "then": { "required": ["grantedAt"] }
        }
      }
    },
    "captureAction": {
      "description": "依序執行的瀏覽器操作。type 動作不得輸入密碼等機密；需要登入的頁面由使用者自行登入（SPEC §11）。",
      "type": "object",
      "additionalProperties": false,
      "required": ["do"],
      "properties": {
        "do": { "enum": ["navigate", "scroll", "click", "hover", "type", "highlight", "script", "wait"] },
        "url": { "type": "string", "format": "uri", "pattern": "^https?://" },
        "selector": { "type": "string", "minLength": 1 },
        "text": { "type": "string" },
        "file": { "description": "script 動作在頁面中執行的 JavaScript 檔（例如在資料很少的報表頁填入示意資料）。需要 capture.domEditConsent。", "$ref": "common.schema.json#/$defs/relPath" },
        "y": { "description": "scroll 的絕對捲動位置（px），與 selector 擇一。", "type": "integer", "minimum": 0 },
        "ms": { "description": "wait 的毫秒數；highlight 時為框住後停留的毫秒數（預設 1200）。", "type": "integer", "minimum": 0, "maximum": 30000 },
        "cut": { "description": "true 時把這個動作從開始到結束（含等待頁面穩定）整段從錄影剪掉。Agent 判斷該段畫面沒有意義時使用，例如單頁應用切換路由的過場、載入中的骨架畫面。", "type": "boolean" }
      },
      "allOf": [
        { "if": { "properties": { "do": { "const": "navigate" } } }, "then": { "required": ["url"] } },
        {
          "if": { "properties": { "do": { "const": "scroll" } } },
          "then": { "oneOf": [{ "required": ["selector"] }, { "required": ["y"] }] }
        },
        {
          "if": { "properties": { "do": { "enum": ["click", "hover", "highlight"] } } },
          "then": { "required": ["selector"] }
        },
        { "if": { "properties": { "do": { "const": "type" } } }, "then": { "required": ["selector", "text"] } },
        { "if": { "properties": { "do": { "const": "script" } } }, "then": { "required": ["file"] } },
        { "if": { "properties": { "do": { "const": "wait" } } }, "then": { "required": ["ms"] } }
      ]
    },
    "code": {
      "description": "程式碼展示，file 與 content 擇一。",
      "type": "object",
      "additionalProperties": false,
      "required": ["language"],
      "properties": {
        "file": { "$ref": "common.schema.json#/$defs/relPath" },
        "content": { "type": "string", "minLength": 1 },
        "language": { "type": "string", "minLength": 1 },
        "highlightLines": {
          "type": "array",
          "items": { "type": "integer", "minimum": 1 },
          "uniqueItems": true
        }
      },
      "oneOf": [{ "required": ["file"] }, { "required": ["content"] }]
    },
    "motion": {
      "description": "motion-graphic 的自訂動畫：Agent 撰寫的 JavaScript 模組（SVG、Canvas、GSAP、Three.js、GLSL、Rough.js 等）或 HyperFrames composition，取代預設的漸層背景，elements 仍疊加在上面。模組要求見 Skill rendering-guide.md#motion。",
      "type": "object",
      "additionalProperties": false,
      "required": ["file"],
      "properties": {
        "file": { "description": "ES module，預設匯出 setup(ctx)，回傳 seek(t) 或在 window.__timelines 登記 GSAP timeline，通常放在 assets/motion.js；或 HyperFrames composition（.html，見 rendering-guide.md#hyperframes）。", "$ref": "common.schema.json#/$defs/relPath", "pattern": "\\.(m?js|html)$" },
        "uses": {
          "description": "模組匯入的共用檔案或資料夾（例如 @/assets/cast/fox/），納入 inputHash：這些檔案一改，scene 就需要重做。資料夾以 / 結尾，包含底下所有檔案。",
          "type": "array",
          "items": { "$ref": "common.schema.json#/$defs/relPath" },
          "uniqueItems": true
        }
      }
    },
    "userAsset": {
      "type": "object",
      "additionalProperties": false,
      "required": ["src", "kind"],
      "properties": {
        "src": { "$ref": "common.schema.json#/$defs/relPath" },
        "kind": { "enum": ["image", "video"] },
        "trimStartSec": { "$ref": "#/$defs/seconds" },
        "trimEndSec": { "$ref": "#/$defs/seconds" },
        "fit": { "enum": ["contain", "cover"], "default": "contain" }
      }
    },
    "element": {
      "type": "object",
      "additionalProperties": false,
      "required": ["type", "at"],
      "properties": {
        "type": { "enum": ["text", "image", "video"] },
        "content": { "description": "type = text 時的文字。", "type": "string", "minLength": 1 },
        "src": { "description": "type = image / video 時的來源。", "$ref": "common.schema.json#/$defs/relPath" },
        "at": { "description": "出現時間（scene 內相對秒數）。", "$ref": "#/$defs/seconds" },
        "duration": { "description": "顯示秒數；省略則持續到 scene 結束。", "type": "number", "exclusiveMinimum": 0 },
        "size": { "description": "type = text 的字級。large / xl 放大，但會自動縮回到不超過兩行、不超出畫面。", "enum": ["normal", "large", "xl"], "default": "normal" },
        "animation": {
          "enum": ["none", "fadeIn", "slideInLeft", "slideInRight", "slideInUp", "slideInDown", "zoomIn", "typewriter"],
          "default": "fadeIn"
        },
        "position": {
          "description": "預設位置，或以畫面百分比指定的自訂座標（元素中心點）。",
          "anyOf": [
            { "enum": ["center", "top", "bottom", "left", "right", "top-left", "top-right", "bottom-left", "bottom-right"] },
            {
              "type": "object",
              "additionalProperties": false,
              "required": ["x", "y"],
              "properties": {
                "x": { "type": "number", "minimum": 0, "maximum": 100 },
                "y": { "type": "number", "minimum": 0, "maximum": 100 }
              }
            }
          ],
          "default": "center"
        }
      },
      "allOf": [
        { "if": { "properties": { "type": { "const": "text" } } }, "then": { "required": ["content"] } },
        { "if": { "properties": { "type": { "enum": ["image", "video"] } } }, "then": { "required": ["src"] } }
      ]
    },
    "render": {
      "type": "object",
      "additionalProperties": false,
      "required": ["inputHash", "outputFile", "renderedAt"],
      "properties": {
        "inputHash": {
          "description": "SPEC §4.2：對 scene.json（排除 status、render、error、attempts、locked、feedback、updatedAt、updatedBy）、旁白稿、scene 素材、project.format 計算。",
          "type": "string",
          "pattern": "^sha256:[0-9a-f]{64}$"
        },
        "outputFile": { "$ref": "common.schema.json#/$defs/relPath", "default": "output/scene.mp4" },
        "renderedAt": { "$ref": "common.schema.json#/$defs/timestamp" },
        "actualDurationSec": { "type": "number", "exclusiveMinimum": 0 }
      }
    },
    "feedbackNote": {
      "type": "object",
      "additionalProperties": false,
      "required": ["id", "text", "createdAt"],
      "properties": {
        "id": { "type": "string", "pattern": "^fb-[0-9a-z]{4,16}$" },
        "text": { "description": "使用者的意見，原話。", "type": "string", "minLength": 1, "maxLength": 1000 },
        "atSec": { "description": "意見指的時間點，相對於這一段影片開頭（秒）。", "type": "number", "minimum": 0 },
        "point": {
          "description": "意見指的畫面位置，以畫面寬高的比例表示（左上角為 0,0）。",
          "type": "object",
          "additionalProperties": false,
          "required": ["x", "y"],
          "properties": {
            "x": { "type": "number", "minimum": 0, "maximum": 1 },
            "y": { "type": "number", "minimum": 0, "maximum": 1 }
          }
        },
        "createdAt": { "$ref": "common.schema.json#/$defs/timestamp" },
        "resolvedAt": {
          "description": "Agent 處理完的時間；null 或不存在表示尚未處理。",
          "anyOf": [{ "$ref": "common.schema.json#/$defs/timestamp" }, { "type": "null" }]
        },
        "reply": { "description": "Agent 給使用者的簡短說明：改了什麼，或為什麼沒改。", "type": "string", "maxLength": 500 }
      }
    },
    "error": {
      "type": "object",
      "additionalProperties": false,
      "required": ["step", "message", "at"],
      "properties": {
        "step": { "enum": ["tts", "capture", "render", "validate", "other"] },
        "message": { "type": "string", "minLength": 1 },
        "at": { "$ref": "common.schema.json#/$defs/timestamp" },
        "hint": { "description": "給使用者的重試或修正建議。", "type": "string" }
      }
    }
  }
}
