{
  "$schema": "../../schemas/scene.schema.json",
  "id": "scene-003",
  "title": "產品介紹",
  "purpose": "solution",
  "narration": {
    "scriptFile": "script.md",
    "provider": "edge-tts",
    "voice": "zh-TW-HsiaoChenNeural",
    "speed": 1.0,
    "audioFile": "assets/narration.mp3"
  },
  "visual": {
    "type": "web-capture",
    "description": "捲動至功能區並高亮第一張卡片",
    "capture": {
      "url": "https://example.com",
      "actions": [
        {
          "do": "scroll",
          "selector": "#features"
        },
        {
          "do": "wait",
          "ms": 500
        },
        {
          "do": "highlight",
          "selector": "#features .card:first-child"
        }
      ]
    },
    "elements": [
      {
        "type": "text",
        "content": "一鍵部署",
        "animation": "fadeIn",
        "at": 0.5,
        "position": "bottom"
      },
      {
        "type": "image",
        "src": "@/assets/logo.png",
        "animation": "slideInLeft",
        "at": 0,
        "position": {
          "x": 10,
          "y": 10
        }
      }
    ],
    "transitionIn": "fade"
  },
  "durationSec": null,
  "status": "stale",
  "render": {
    "inputHash": "sha256:aaaaaaaaaaaaaaaaaaaaaaaaaaaaaaaaaaaaaaaaaaaaaaaaaaaaaaaaaaaaaaaa",
    "outputFile": "output/scene.mp4",
    "renderedAt": "2026-09-30T14:10:00Z",
    "actualDurationSec": 6.2
  },
  "locked": false,
  "error": null,
  "attempts": 0,
  "updatedAt": "2026-09-30T14:10:00Z",
  "updatedBy": "user",
  "feedback": [
    {
      "id": "fb-k3x9",
      "text": "這裡的卡片太暗，看不清楚",
      "atSec": 2.4,
      "point": {
        "x": 0.62,
        "y": 0.41
      },
      "createdAt": "2026-10-01T09:00:00Z",
      "resolvedAt": null
    },
    {
      "id": "fb-a7m2",
      "text": "旁白講太快",
      "createdAt": "2026-09-30T15:00:00Z",
      "resolvedAt": "2026-09-30T16:00:00Z",
      "reply": "語速從 1.0 調到 0.9 並重新產生旁白"
    }
  ]
}
